{
  "$schema": "https://json-schema.org/draft/2020-12/schema",
  "$id": "wave-plan.schema.json",
  "title": "Wave Plan",
  "description": "Output of the plan-analyzer agent. Defines legacy waves plus, on DAG-capable runs, a stable task graph. `rationale` and `complexity_signals` are emitted only when verbose mode is enabled.",
  "type": "object",
  "required": ["source_plan", "context7_available", "waves", "uncovered_plan_sections"],
  "properties": {
    "source_plan": {"type": "string", "description": "Path to the input plan.md file"},
    "context7_available": {"type": "boolean"},
    "waves": {
      "type": "array",
      "minItems": 1,
      "items": {
        "type": "object",
        "required": ["wave_id", "agents"],
        "properties": {
          "wave_id": {"type": "integer", "minimum": 1},
          "rationale": {"type": "string", "maxLength": 2000, "description": "Verbose mode only. Why these tasks belong together in this wave. Pre-1.13.0 artifacts uncapped."},
          "agents": {
            "type": "array",
            "minItems": 1,
            "maxItems": 6,
            "items": {
              "type": "object",
              "required": ["agent_id", "task_title", "task_excerpt_lines", "owned_files", "acceptance_criteria", "recommended_model"],
              "properties": {
                "agent_id": {"type": "string", "pattern": "^wave-[0-9]+-agent-[0-9]+$"},
                "task_title": {"type": "string"},
                "task_excerpt_lines": {"type": "string", "pattern": "^[0-9]+-[0-9]+$", "description": "Line range in source_plan, 1-indexed inclusive, e.g. '45-62'. Dev agents read this range from source_plan rather than receiving the prose inline."},
                "owned_files": {"type": "array", "minItems": 1, "items": {"type": "string"}},
                "acceptance_criteria": {"type": "array", "minItems": 1, "items": {"type": "string"}},
                "recommended_model": {"type": "string", "enum": ["haiku", "sonnet", "opus"]},
                "complexity_signals": {"type": "array", "items": {"type": "string", "maxLength": 500}, "description": "Verbose mode only. Observations about inference confidence (e.g., 'file path inferred'). Pre-1.13.0 artifacts uncapped."},
                "role": {"type": "string", "enum": ["test-author", "impl", "standalone"], "description": "TDD role. Omitted on classic (non-TDD) runs."},
                "testable": {"type": "boolean", "description": "TDD mode only. True for test-author/impl agents, false for non-testable standalone tasks."},
                "non_testable_reason": {"type": "string", "description": "TDD mode only. One-line reason a standalone task was classified non-testable."},
                "tests_to_satisfy": {"type": "array", "items": {"type": "string"}, "description": "impl role only. Test files (from the paired test-author) the implementation must make pass."},
                "inline_tests": {"type": "boolean", "description": "test-author role only. True when the task's unit tests must live inside the implementation file itself (e.g. a [[bin]]-style target whose internals are unreachable from an external test file). Exempts exactly one shared file from the Step 2 test-author/impl owned_files disjointness check. Optional -- wave plans written before this field existed (pre-1.18.0) omit it, which means false."}
              }
            }
          }
        }
      }
    },
    "uncovered_plan_sections": {"type": "array", "items": {"type": "string"}},
    "task_graph": {
      "description": "Additive DAG artifact. Omitted only by analyzers from before DAG execution support; DAG mode requires it and additionally validates the standalone task-graph schema plus graph-wide dependency invariants before dispatch.",
      "type": "object",
      "required": ["source_plan", "context7_available", "tasks", "uncovered_plan_sections"],
      "properties": {
        "source_plan": {"type": "string"},
        "context7_available": {"type": "boolean"},
        "tasks": {
          "type": "array",
          "minItems": 1,
          "items": {
            "type": "object",
            "required": ["task_id", "task_title", "task_excerpt_lines", "depends_on", "owned_files", "acceptance_criteria", "recommended_model", "verification_scope"],
            "properties": {
              "task_id": {"type": "string", "pattern": "^[A-Za-z0-9][A-Za-z0-9._:-]*$"},
              "task_title": {"type": "string", "minLength": 1},
              "task_excerpt_lines": {"type": "string", "pattern": "^[0-9]+-[0-9]+$"},
              "depends_on": {"type": "array", "items": {"type": "string"}, "uniqueItems": true},
              "owned_files": {"type": "array", "minItems": 1, "items": {"type": "string"}, "uniqueItems": true},
              "acceptance_criteria": {"type": "array", "minItems": 1, "items": {"type": "string"}},
              "recommended_model": {"type": "string", "enum": ["haiku", "sonnet", "opus"]},
              "role": {"type": "string", "enum": ["test-author", "impl", "standalone"]},
              "testable": {"type": "boolean"},
              "tests_to_satisfy": {"type": "array", "items": {"type": "string"}},
              "verification_scope": {"type": "array", "minItems": 1, "items": {"type": "string"}, "uniqueItems": true},
              "risk": {"type": "string", "enum": ["low", "medium", "high"]}
            }
          }
        },
        "uncovered_plan_sections": {"type": "array", "items": {"type": "string"}},
        "token_usage": {"type": ["object", "null"]}
      }
    },
    "token_usage": {
      "type": ["object", "null"],
      "description": "Analyzer's token self-report: the most recent usage figure the harness surfaced to it in-band (e.g. a token-budget system warning), or null when none appeared. A lower bound, never an estimate. Used by the orchestrator as a fallback when the analyzer's completion result carries no usage figure. Optional for back-compat with wave plans written before 1.11.0.",
      "properties": {
        "input": {"type": ["integer", "null"]},
        "output": {"type": ["integer", "null"]},
        "total": {"type": ["integer", "null"]}
      }
    }
  }
}
